{
  "$schema": "https://raw.githubusercontent.com/madbrolab/dian115/main/docs/plugin-platform/manifest.schema.json",
  "schema_version": 1,
  "id": "example.complete-plugin",
  "name": "完整插件示例",
  "version": "1.0.0",
  "description": "最小第三方插件：受管页面偏好和只读状态检查。",
  "default_locale": "zh-CN",
  "publisher": {
    "name": "Example Publisher",
    "key_id": "ed25519:REPLACED_BY_PACKAGER",
    "url": "https://example.com/plugins"
  },
  "compatibility": {
    "dian115": ">=5.0.46 <6.0.0",
    "plugin_api": "^2.0"
  },
  "runtime": {
    "kind": "wasm",
    "entry": "runtime/plugin.wasm",
    "protocol": "dian115:wasm@1",
    "startup_timeout_ms": 10000,
    "shutdown_timeout_ms": 5000,
    "timeout_ms": 30000,
    "background_timeout_ms": 30000,
    "max_concurrency": 1,
    "restart_policy": "on-failure",
    "memory_mb": 32,
    "resident": false
  },
  "permissions": {
    "apis": [],
    "network": []
  },
  "ui": {
    "mode": "page",
    "entry": "frontend/dist/index.html",
    "assets_root": "frontend/dist",
    "icon": "frontend/icon.svg"
  },
  "homepage": "https://example.com/plugins/complete-plugin",
  "repository": "https://example.com/source/complete-plugin",
  "license": "MIT",
  "tags": [
    "utility"
  ]
}
